{
  "$schema": "https://json-schema.org/draft/2020-12/schema",
  "$id": "https://acg.dev/schema/agent_lock/v1",
  "title": "Agent Context Graph Lockfile",
  "description": "Committable plan that pins each task's predicted writes, allowed paths, and DAG position.",
  "type": "object",
  "required": ["version", "generated_at", "repo", "tasks", "execution_plan"],
  "properties": {
    "version": {
      "const": "1.0",
      "description": "Schema version of this lockfile; bumped on breaking shape changes."
    },
    "generated_at": {
      "type": "string",
      "format": "date-time",
      "description": "UTC timestamp when the compiler emitted this lockfile."
    },
    "generator": {
      "type": ["object", "null"],
      "description": "Provenance metadata describing the tool and model that produced the lockfile.",
      "properties": {
        "tool": {
          "type": "string",
          "description": "Name of the tool that generated the lockfile (e.g. 'acg')."
        },
        "version": {
          "type": "string",
          "description": "Semantic version of the generating tool."
        },
        "model": {
          "type": ["string", "null"],
          "description": "Identifier of the LLM used for predictor reranking, if any."
        }
      }
    },
    "repo": {
      "type": "object",
      "description": "Repository metadata captured at compile time.",
      "required": ["root", "languages"],
      "properties": {
        "root": {
          "type": "string",
          "description": "Absolute or repo-relative path to the repository root."
        },
        "git_url": {
          "type": ["string", "null"],
          "description": "Optional remote URL of the repository for cross-machine reference."
        },
        "commit": {
          "type": ["string", "null"],
          "description": "Git commit SHA the lockfile was compiled against."
        },
        "languages": {
          "type": "array",
          "description": "Programming languages detected in the repo (e.g. 'typescript', 'python').",
          "items": {
            "type": "string",
            "description": "A single language identifier in lowercase."
          }
        }
      }
    },
    "tasks": {
      "type": "array",
      "description": "All compiled tasks with their predicted writes and allowed-path globs.",
      "items": { "$ref": "#/$defs/Task" }
    },
    "execution_plan": {
      "type": "object",
      "description": "Topologically ordered DAG of parallel and serial groups for the runtime.",
      "required": ["groups"],
      "properties": {
        "groups": {
          "type": "array",
          "description": "Ordered execution groups; later groups wait on their declared upstream groups.",
          "items": { "$ref": "#/$defs/Group" }
        }
      }
    },
    "conflicts_detected": {
      "type": "array",
      "description": "Cross-task overlaps the planner found, plus how each was resolved.",
      "items": { "$ref": "#/$defs/Conflict" }
    }
  },
  "$defs": {
    "Task": {
      "type": "object",
      "description": "A single task as serialized into the lockfile.",
      "required": ["id", "prompt", "predicted_writes", "allowed_paths", "depends_on"],
      "properties": {
        "id": {
          "type": "string",
          "pattern": "^[a-z0-9_-]+$",
          "description": "Stable, kebab-case task identifier; unique within a lockfile."
        },
        "prompt": {
          "type": "string",
          "description": "Natural-language description of what the task should accomplish."
        },
        "predicted_writes": {
          "type": "array",
          "description": "Predictor's anticipated file edits, sorted by descending confidence.",
          "items": { "$ref": "#/$defs/PredictedWrite" }
        },
        "allowed_paths": {
          "type": "array",
          "description": "Glob patterns the task is permitted to write; enforced by validate_write().",
          "items": {
            "type": "string",
            "description": "A repo-relative glob pattern (e.g. 'src/app/**/*.ts')."
          }
        },
        "candidate_context_paths": {
          "type": "array",
          "description": "Repo-relative files that may be relevant context but do not grant write authority without replan or approval.",
          "items": {
            "type": "string",
            "description": "A repo-relative file path surfaced for context."
          }
        },
        "file_scopes": {
          "type": "array",
          "description": "Tiered localization results used to separate hard write scope from candidate context.",
          "items": { "$ref": "#/$defs/FileScope" }
        },
        "depends_on": {
          "type": "array",
          "description": "Upstream task ids that must finish before this task starts.",
          "items": {
            "type": "string",
            "description": "Id of an upstream task this task depends on."
          }
        },
        "parallel_group": {
          "type": ["integer", "null"],
          "minimum": 1,
          "description": "DAG level this task belongs to; same group ids may run in parallel."
        },
        "rationale": {
          "type": ["string", "null"],
          "description": "Optional human-facing note explaining the task's scope or risk."
        }
      }
    },
    "FileScope": {
      "type": "object",
      "description": "A localized file with its lockfile tier and supporting signals.",
      "required": ["path", "tier", "score", "signals", "reason"],
      "properties": {
        "path": {
          "type": "string",
          "description": "Repo-relative file path."
        },
        "tier": {
          "enum": ["must_write", "candidate_context", "needs_replan"],
          "description": "How ACG should treat this file: hard write authority, context only, or approval-needed expansion."
        },
        "score": {
          "type": "number",
          "minimum": 0,
          "maximum": 1,
          "description": "Localization score on [0, 1]."
        },
        "signals": {
          "type": "array",
          "description": "Signal families supporting this scope decision.",
          "items": {
            "type": "string",
            "description": "Signal family name such as llm, bm25, graph, symbol, or cochange."
          }
        },
        "reason": {
          "type": "string",
          "description": "Human-readable rationale for the tier decision."
        }
      }
    },
    "PredictedWrite": {
      "type": "object",
      "description": "A predicted file write with confidence and short rationale.",
      "required": ["path", "confidence"],
      "properties": {
        "path": {
          "type": "string",
          "description": "Repo-relative path the predictor expects the task to modify."
        },
        "confidence": {
          "type": "number",
          "minimum": 0,
          "maximum": 1,
          "description": "Predictor confidence in the prediction, on [0, 1]."
        },
        "reason": {
          "type": "string",
          "description": "Short explanation of why the predictor flagged this path."
        }
      }
    },
    "Group": {
      "type": "object",
      "description": "A node in the execution DAG; runs after all of its waits_for groups.",
      "required": ["id", "tasks", "type"],
      "properties": {
        "id": {
          "type": "integer",
          "minimum": 1,
          "description": "Monotonic group identifier, 1-indexed in execution order."
        },
        "tasks": {
          "type": "array",
          "description": "Task ids that belong to this group.",
          "items": {
            "type": "string",
            "description": "Id of a task contained in this group."
          }
        },
        "type": {
          "enum": ["parallel", "serial"],
          "description": "Whether tasks in this group run concurrently or one after another."
        },
        "waits_for": {
          "type": "array",
          "description": "Group ids that must complete before this group starts.",
          "items": {
            "type": "integer",
            "description": "Id of an upstream group this group depends on."
          }
        }
      }
    },
    "Conflict": {
      "type": "object",
      "description": "A detected file overlap between two or more tasks and the chosen resolution.",
      "required": ["files", "between_tasks", "resolution"],
      "properties": {
        "files": {
          "type": "array",
          "description": "Repo-relative file paths shared by the conflicting tasks.",
          "items": {
            "type": "string",
            "description": "A single shared file path."
          }
        },
        "between_tasks": {
          "type": "array",
          "description": "Ids of the tasks that overlap on the listed files.",
          "items": {
            "type": "string",
            "description": "Id of a task involved in the conflict."
          }
        },
        "resolution": {
          "type": "string",
          "description": "How the planner resolved the conflict (e.g. 'serialize', 'manual')."
        }
      }
    }
  }
}
