{
  "version": "1.0",
  "generated_at": "2026-05-11T03:20:36Z",
  "generator": {
    "tool": "manual-pr-history",
    "version": "1.0",
    "model": "github-pr-metadata"
  },
  "repo": {
    "root": "experiments/real_repos/express/checkout",
    "git_url": null,
    "commit": null,
    "languages": [
      "javascript"
    ]
  },
  "tasks": [
    {
      "id": "pr-6088",
      "prompt": "Enhance req.acceptsCharsets handling so charset negotiation works correctly across accepted, missing, and rejected values, and cover the behavior with request charset tests.",
      "predicted_writes": [
        {
          "path": "lib/request.js",
          "confidence": 1.0,
          "reason": "Changed source file in Express PR #6088."
        },
        {
          "path": "test/req.acceptsCharsets.js",
          "confidence": 1.0,
          "reason": "Changed regression test in Express PR #6088."
        }
      ],
      "allowed_paths": [
        "lib/request.js",
        "test/req.acceptsCharsets.js"
      ],
      "depends_on": [],
      "parallel_group": 1,
      "rationale": null
    }
  ],
  "execution_plan": {
    "groups": [
      {
        "id": 1,
        "tasks": [
          "pr-6088"
        ],
        "type": "parallel",
        "waits_for": []
      }
    ]
  },
  "conflicts_detected": []
}
