{
  "version": "1.0",
  "generated_at": "2026-05-10T07:28:42.040831Z",
  "generator": {
    "tool": "acg",
    "version": "0.1.0",
    "model": "qwen/qwen3-coder-30b-a3b-instruct"
  },
  "repo": {
    "root": "/Users/prajit/Desktop/projects/cognition/experiments/real_repos/starlette/checkout",
    "git_url": null,
    "commit": null,
    "languages": [
      "unknown"
    ]
  },
  "tasks": [
    {
      "id": "pr3137-cors-credentials-origin",
      "prompt": "Update CORSMiddleware so simple responses with allow_origins=['*'] and allow_credentials=True echo the explicit request Origin instead of '*', matching preflight behavior and credentialed CORS requirements.",
      "predicted_writes": [
        {
          "path": "starlette/middleware/cors.py",
          "confidence": 0.78,
          "reason": "Task specifically targets updating CORSMiddleware behavior related to allow_origins and allow_credentials handling. Signals: bm25, env."
        }
      ],
      "allowed_paths": [
        "starlette/middleware/cors.py"
      ],
      "candidate_context_paths": [
        "starlette/requests.py",
        "starlette/routing.py",
        "starlette/testclient.py"
      ],
      "file_scopes": [
        {
          "path": "starlette/middleware/cors.py",
          "tier": "must_write",
          "score": 0.78,
          "signals": [
            "bm25",
            "env"
          ],
          "reason": "Task specifically targets updating CORSMiddleware behavior related to allow_origins and allow_credentials handling. Signals: bm25, env."
        },
        {
          "path": "starlette/requests.py",
          "tier": "candidate_context",
          "score": 0.9,
          "signals": [
            "pagerank"
          ],
          "reason": "personalized PageRank rank #1, top symbol matches: Request. Candidate context only; requires replan before write. Signals: pagerank."
        },
        {
          "path": "starlette/routing.py",
          "tier": "candidate_context",
          "score": 0.9,
          "signals": [
            "pagerank"
          ],
          "reason": "personalized PageRank rank #3, top symbol matches: instead, of, request_response. Candidate context only; requires replan before write. Signals: pagerank."
        },
        {
          "path": "starlette/testclient.py",
          "tier": "candidate_context",
          "score": 0.9,
          "signals": [
            "pagerank"
          ],
          "reason": "personalized PageRank rank #4, top symbol matches: WebSocketDenialResponse, handle_request, request. Candidate context only; requires replan before write. Signals: pagerank."
        }
      ],
      "depends_on": [],
      "parallel_group": 1,
      "rationale": null
    }
  ],
  "execution_plan": {
    "groups": [
      {
        "id": 1,
        "tasks": [
          "pr3137-cors-credentials-origin"
        ],
        "type": "parallel",
        "waits_for": []
      }
    ]
  },
  "conflicts_detected": []
}
