{
  "version": "1.0",
  "generated_at": "2026-05-11T03:44:18.834725Z",
  "generator": {
    "tool": "acg",
    "version": "0.1.0",
    "model": "qwen/qwen3-coder-30b-a3b-instruct",
    "tokens_planner_total": null,
    "tokens_scope_review_total": 6999
  },
  "repo": {
    "root": "/Users/prajit/Desktop/projects/cognition/experiments/real_repos/commander_js/checkout",
    "git_url": null,
    "commit": null,
    "languages": [
      "typescript"
    ]
  },
  "tasks": [
    {
      "id": "pr-2410",
      "prompt": "Fix variadic argument and option collection so repeated variadic values are appended instead of replacing earlier values, and add regression coverage for argument and option parsing.",
      "predicted_writes": [
        {
          "path": "lib/command.js",
          "confidence": 0.9,
          "reason": "Task involves variadic argument and option collection logic, and this file contains core parsing and handling logic. Signals: llm, pagerank. Scope review kept this file at its existing tier."
        },
        {
          "path": "tests/args.variadic.test.js",
          "confidence": 0.9,
          "reason": "Task requires regression coverage for variadic arguments, so test file for variadic args should be modified. Signals: llm, testlink. Scope review kept this file at its existing tier."
        },
        {
          "path": "tests/options.variadic.test.js",
          "confidence": 0.9,
          "reason": "Task requires regression coverage for variadic options, so test file for variadic options should be modified. Signals: llm, testlink. Scope review kept this file at its existing tier."
        },
        {
          "path": "lib/argument.js",
          "confidence": 0.85,
          "reason": "Variadic argument handling is directly related to argument processing, which is implemented in this file. Signals: graph, llm. Scope review kept this file at its existing tier."
        },
        {
          "path": "lib/option.js",
          "confidence": 0.85,
          "reason": "Option parsing and collection logic is implemented here, directly relevant to the task. Signals: graph, llm. Scope review kept this file at its existing tier."
        }
      ],
      "allowed_paths": [
        "lib/argument.js",
        "lib/command.js",
        "lib/option.js",
        "tests/args.variadic.test.js",
        "tests/options.variadic.test.js"
      ],
      "candidate_context_paths": [
        "__tests__/argument.test.ts",
        "__tests__/option.test.ts"
      ],
      "file_scopes": [
        {
          "path": "lib/command.js",
          "tier": "must_write",
          "score": 0.9,
          "signals": [
            "llm",
            "pagerank",
            "scope_review"
          ],
          "reason": "Task involves variadic argument and option collection logic, and this file contains core parsing and handling logic. Signals: llm, pagerank. Scope review kept this file at its existing tier."
        },
        {
          "path": "tests/args.variadic.test.js",
          "tier": "must_write",
          "score": 0.9,
          "signals": [
            "llm",
            "scope_review",
            "testlink"
          ],
          "reason": "Task requires regression coverage for variadic arguments, so test file for variadic args should be modified. Signals: llm, testlink. Scope review kept this file at its existing tier."
        },
        {
          "path": "tests/options.variadic.test.js",
          "tier": "must_write",
          "score": 0.9,
          "signals": [
            "llm",
            "scope_review",
            "testlink"
          ],
          "reason": "Task requires regression coverage for variadic options, so test file for variadic options should be modified. Signals: llm, testlink. Scope review kept this file at its existing tier."
        },
        {
          "path": "lib/argument.js",
          "tier": "must_write",
          "score": 0.85,
          "signals": [
            "graph",
            "llm",
            "scope_review"
          ],
          "reason": "Variadic argument handling is directly related to argument processing, which is implemented in this file. Signals: graph, llm. Scope review kept this file at its existing tier."
        },
        {
          "path": "lib/option.js",
          "tier": "must_write",
          "score": 0.85,
          "signals": [
            "graph",
            "llm",
            "scope_review"
          ],
          "reason": "Option parsing and collection logic is implemented here, directly relevant to the task. Signals: graph, llm. Scope review kept this file at its existing tier."
        },
        {
          "path": "__tests__/argument.test.ts",
          "tier": "candidate_context",
          "score": 0.85,
          "signals": [
            "framework",
            "scope_review"
          ],
          "reason": "jest convention: __tests__/ with .test.ts extension, entity 'argument' from task prompt. Candidate context only; requires replan before write. Signals: framework. Scope review requested a drop, but protected evidence kept it."
        },
        {
          "path": "__tests__/option.test.ts",
          "tier": "candidate_context",
          "score": 0.85,
          "signals": [
            "framework",
            "scope_review"
          ],
          "reason": "jest convention: __tests__/ with .test.ts extension, entity 'option' from task prompt. Candidate context only; requires replan before write. Signals: framework. Scope review requested a drop, but protected evidence kept it."
        }
      ],
      "depends_on": [],
      "parallel_group": 1,
      "rationale": null
    }
  ],
  "execution_plan": {
    "groups": [
      {
        "id": 1,
        "tasks": [
          "pr-2410"
        ],
        "type": "parallel",
        "waits_for": []
      }
    ]
  },
  "conflicts_detected": []
}
