{
  "version": "1.0",
  "generated_at": "2026-05-07T05:26:49.715802Z",
  "generator": {
    "tool": "acg",
    "version": "0.1.0",
    "model": "mock-llm-canned"
  },
  "repo": {
    "root": "experiments/real_repos/fastify/checkout",
    "git_url": null,
    "commit": null,
    "languages": [
      "javascript"
    ]
  },
  "tasks": [
    {
      "id": "pr-6653",
      "prompt": "Add a readonly request.mediaType property that exposes the parsed request Content-Type media type, cache the parsed ContentType on the request, and update validation and request handling to reuse the parsed value.",
      "predicted_writes": [
        {
          "path": "types/content-type-parser.d.ts",
          "confidence": 0.9999999852032609,
          "reason": "BM25 lexical match over path, identifiers, imports, docstrings (score 46.81)."
        },
        {
          "path": "test/content-parser.test.js",
          "confidence": 0.9999997165305126,
          "reason": "BM25 lexical match over path, identifiers, imports, docstrings (score 39.42)."
        },
        {
          "path": "lib/content-type-parser.js",
          "confidence": 0.9999977592532014,
          "reason": "BM25 lexical match over path, identifiers, imports, docstrings (score 34.25)."
        },
        {
          "path": "test/internals/validation.test.js",
          "confidence": 0.85,
          "reason": "Symbol 'validation' referenced in prompt; defined in test/internals/validation.test.js."
        },
        {
          "path": "test/logger/logger-test-utils.js",
          "confidence": 0.85,
          "reason": "Symbol 'request' referenced in prompt; defined in test/logger/logger-test-utils.js."
        }
      ],
      "allowed_paths": [
        "lib/content-type-parser.js",
        "test/content-parser.test.js",
        "test/internals/validation.test.js",
        "test/logger/logger-test-utils.js",
        "types/content-type-parser.d.ts"
      ],
      "depends_on": [],
      "parallel_group": 1,
      "rationale": null
    }
  ],
  "execution_plan": {
    "groups": [
      {
        "id": 1,
        "tasks": [
          "pr-6653"
        ],
        "type": "parallel",
        "waits_for": []
      }
    ]
  },
  "conflicts_detected": []
}
