{
  "version": "1.0",
  "generated_at": "2026-05-13T04:58:57.074695Z",
  "generator": {
    "tool": "acg",
    "version": "0.1.0",
    "model": "claude-sonnet-4-6",
    "tokens_planner_total": 1832,
    "tokens_scope_review_total": 866,
    "tokens_planner_completion_total": 178,
    "tokens_planner_method": "provider_usage",
    "compile_wall_seconds": 4.7757,
    "compile_cost_usd": null
  },
  "repo": {
    "root": "experiments/real_repos/click/checkout",
    "git_url": null,
    "commit": null,
    "languages": [
      "typescript"
    ]
  },
  "tasks": [
    {
      "id": "pr3363-unprocessed-flag-value",
      "prompt": "Fix Option initialization so that when flag_value is set to a non-basic type (e.g. an enum), the option's type is automatically set to UNPROCESSED instead of raising a TypeError or mishandling the value during parsing.",
      "predicted_writes": [
        {
          "path": "src/click/core.py",
          "confidence": 1.0,
          "reason": "manual: ACG predictor returned empty allowed_paths/predicted_writes for click; populated from manifest ground_truth_files. Predictor accuracy on click is a separate paper finding."
        },
        {
          "path": "tests/test_options.py",
          "confidence": 0.7,
          "reason": "manual: test file from manifest ground_truth_files"
        }
      ],
      "allowed_paths": [
        "src/click/core.py",
        "tests/test_options.py"
      ],
      "candidate_context_paths": [
        "src/click/core.py",
        "CHANGES.rst"
      ],
      "file_scopes": [
        {
          "path": "src/click/core.py",
          "tier": "candidate_context",
          "score": 0.95,
          "signals": [
            "bm25",
            "llm",
            "pagerank",
            "scope_review"
          ],
          "reason": "Option class initialization logic for flag_value and type needs to be modified to set type to UNPROCESSED for non-basic types. Candidate context only; requires replan before write. Signals: bm25, llm, pagerank. Scope review requested a drop, but protected evidence kept it."
        },
        {
          "path": "CHANGES.rst",
          "tier": "candidate_context",
          "score": 0.7,
          "signals": [
            "cochange",
            "llm",
            "scope_review"
          ],
          "reason": "Bug fix changelog entry likely needed for this Option initialization fix. Candidate context only; requires replan before write. Signals: cochange, llm. Scope review requested a drop, but protected evidence kept it."
        }
      ],
      "depends_on": [],
      "parallel_group": 1,
      "rationale": null
    }
  ],
  "execution_plan": {
    "groups": [
      {
        "id": 1,
        "tasks": [
          "pr3363-unprocessed-flag-value"
        ],
        "type": "parallel",
        "waits_for": []
      }
    ]
  },
  "conflicts_detected": []
}
