{
  "version": "1.0",
  "generated_at": "2026-05-11T03:51:46.029864Z",
  "generator": {
    "tool": "acg",
    "version": "0.1.0",
    "model": "qwen/qwen3-coder-30b-a3b-instruct",
    "tokens_planner_total": null,
    "tokens_scope_review_total": 7474
  },
  "repo": {
    "root": "/Users/prajit/Desktop/projects/cognition/experiments/real_repos/commander_js/checkout",
    "git_url": null,
    "commit": null,
    "languages": [
      "typescript"
    ]
  },
  "tasks": [
    {
      "id": "pr-2410",
      "prompt": "Fix variadic argument and option collection so repeated variadic values are appended instead of replacing earlier values, and add regression coverage for argument and option parsing.",
      "predicted_writes": [
        {
          "path": "tests/args.variadic.test.js",
          "confidence": 0.9,
          "reason": "Task mentions regression coverage for variadic arguments, and this test file specifically covers variadic argument parsing. Signals: llm, testlink. Scope review kept this file at its existing tier."
        },
        {
          "path": "tests/options.variadic.test.js",
          "confidence": 0.9,
          "reason": "Task mentions regression coverage for option parsing, and this test file covers variadic option parsing. Signals: llm, testlink. Scope review kept this file at its existing tier."
        },
        {
          "path": "tests/argument.variadic.test.js",
          "confidence": 0.85,
          "reason": "Task involves variadic argument handling, and this test file specifically targets variadic arguments in argument parsing. Signals: llm, testlink. Scope review kept this file at its existing tier."
        }
      ],
      "allowed_paths": [
        "tests/args.variadic.test.js",
        "tests/argument.variadic.test.js",
        "tests/options.variadic.test.js"
      ],
      "candidate_context_paths": [
        "lib/command.js",
        "__tests__/argument.test.ts",
        "__tests__/option.test.ts"
      ],
      "file_scopes": [
        {
          "path": "tests/args.variadic.test.js",
          "tier": "must_write",
          "score": 0.9,
          "signals": [
            "llm",
            "scope_review",
            "testlink"
          ],
          "reason": "Task mentions regression coverage for variadic arguments, and this test file specifically covers variadic argument parsing. Signals: llm, testlink. Scope review kept this file at its existing tier."
        },
        {
          "path": "tests/options.variadic.test.js",
          "tier": "must_write",
          "score": 0.9,
          "signals": [
            "llm",
            "scope_review",
            "testlink"
          ],
          "reason": "Task mentions regression coverage for option parsing, and this test file covers variadic option parsing. Signals: llm, testlink. Scope review kept this file at its existing tier."
        },
        {
          "path": "tests/argument.variadic.test.js",
          "tier": "must_write",
          "score": 0.85,
          "signals": [
            "llm",
            "scope_review",
            "testlink"
          ],
          "reason": "Task involves variadic argument handling, and this test file specifically targets variadic arguments in argument parsing. Signals: llm, testlink. Scope review kept this file at its existing tier."
        },
        {
          "path": "lib/command.js",
          "tier": "candidate_context",
          "score": 0.95,
          "signals": [
            "bm25",
            "entity",
            "llm",
            "pagerank",
            "scip",
            "scope_review"
          ],
          "reason": "Task directly involves variadic argument and option parsing logic, and this file contains the core implementation of argument and option handling. Candidate context only; requires replan before write. Signals: bm25, entity, llm, pagerank, scip. Scope review kept this file at its existing tier."
        },
        {
          "path": "__tests__/argument.test.ts",
          "tier": "candidate_context",
          "score": 0.85,
          "signals": [
            "framework",
            "scope_review"
          ],
          "reason": "jest convention: __tests__/ with .test.ts extension, entity 'argument' from task prompt. Candidate context only; requires replan before write. Signals: framework. Scope review requested a drop, but protected evidence kept it."
        },
        {
          "path": "__tests__/option.test.ts",
          "tier": "candidate_context",
          "score": 0.85,
          "signals": [
            "framework",
            "scope_review"
          ],
          "reason": "jest convention: __tests__/ with .test.ts extension, entity 'option' from task prompt. Candidate context only; requires replan before write. Signals: framework. Scope review requested a drop, but protected evidence kept it."
        }
      ],
      "depends_on": [],
      "parallel_group": 1,
      "rationale": null
    }
  ],
  "execution_plan": {
    "groups": [
      {
        "id": 1,
        "tasks": [
          "pr-2410"
        ],
        "type": "parallel",
        "waits_for": []
      }
    ]
  },
  "conflicts_detected": []
}
