{
  "version": "1.0",
  "generated_at": "2026-05-10T07:28:49.826780Z",
  "generator": {
    "tool": "acg",
    "version": "0.1.0",
    "model": "qwen/qwen3-coder-30b-a3b-instruct"
  },
  "repo": {
    "root": "/Users/prajit/Desktop/projects/cognition/experiments/real_repos/starlette/checkout",
    "git_url": null,
    "commit": null,
    "languages": [
      "unknown"
    ]
  },
  "tasks": [
    {
      "id": "pr3166-session-middleware",
      "prompt": "Change SessionMiddleware so it can distinguish session access from mutation, avoid sending Set-Cookie for unchanged sessions, preserve cookie clearing behavior, and add regression coverage for concurrent/read-only session flows.",
      "predicted_writes": [
        {
          "path": "starlette/middleware/sessions.py",
          "confidence": 0.95,
          "reason": "Task explicitly mentions changing SessionMiddleware, and this is the most likely file to contain the implementation. Signals: llm."
        }
      ],
      "allowed_paths": [
        "starlette/middleware/sessions.py"
      ],
      "candidate_context_paths": [
        "starlette/requests.py",
        "starlette/routing.py",
        "starlette/testclient.py",
        "tests/middleware/test_base.py",
        "tests/test_responses.py",
        "tests/test_routing.py",
        "tests/test_pr3166-session-middleware.py"
      ],
      "file_scopes": [
        {
          "path": "starlette/middleware/sessions.py",
          "tier": "must_write",
          "score": 0.95,
          "signals": [
            "llm"
          ],
          "reason": "Task explicitly mentions changing SessionMiddleware, and this is the most likely file to contain the implementation. Signals: llm."
        },
        {
          "path": "starlette/requests.py",
          "tier": "candidate_context",
          "score": 0.9,
          "signals": [
            "pagerank"
          ],
          "reason": "personalized PageRank rank #1, top symbol matches: _get_form, cookie_parser, cookies. Candidate context only; requires replan before write. Signals: pagerank."
        },
        {
          "path": "starlette/routing.py",
          "tier": "candidate_context",
          "score": 0.9,
          "signals": [
            "pagerank"
          ],
          "reason": "personalized PageRank rank #3, top symbol matches: add_route, add_websocket_route, url_path_for. Candidate context only; requires replan before write. Signals: pagerank."
        },
        {
          "path": "starlette/testclient.py",
          "tier": "candidate_context",
          "score": 0.9,
          "signals": [
            "pagerank"
          ],
          "reason": "personalized PageRank rank #6, top symbol matches: WebSocketTestSession. Candidate context only; requires replan before write. Signals: pagerank."
        },
        {
          "path": "tests/middleware/test_base.py",
          "tier": "candidate_context",
          "score": 0.9,
          "signals": [
            "bm25",
            "pagerank"
          ],
          "reason": "personalized PageRank rank #2, top symbol matches: ConsumingMiddleware, ContextManagerMiddleware, CustomMiddleware.; BM25 lexical match over path, identifiers, imports, docstrings (score 18.00). Candidate context only; requires replan before write. Signals: bm25, pagerank."
        },
        {
          "path": "tests/test_responses.py",
          "tier": "candidate_context",
          "score": 0.9,
          "signals": [
            "bm25",
            "pagerank"
          ],
          "reason": "personalized PageRank rank #8, top symbol matches: numbers_for_cleanup, test_delete_cookie, test_expires_on_set_cookie.; BM25 lexical match over path, identifiers, imports, docstrings (score 18.29). Candidate context only; requires replan before write. Signals: bm25, pagerank."
        },
        {
          "path": "tests/test_routing.py",
          "tier": "candidate_context",
          "score": 0.9,
          "signals": [
            "pagerank"
          ],
          "reason": "personalized PageRank rank #4, top symbol matches: AddHeadersMiddleware, CustomMiddleware, NamedMiddleware. Candidate context only; requires replan before write. Signals: pagerank."
        },
        {
          "path": "tests/test_pr3166-session-middleware.py",
          "tier": "candidate_context",
          "score": 0.85,
          "signals": [
            "framework"
          ],
          "reason": "pytest convention: tests/ with .py extension, entity 'pr3166-session-middleware' from task prompt. Candidate context only; requires replan before write. Signals: framework."
        }
      ],
      "depends_on": [],
      "parallel_group": 1,
      "rationale": null
    }
  ],
  "execution_plan": {
    "groups": [
      {
        "id": 1,
        "tasks": [
          "pr3166-session-middleware"
        ],
        "type": "parallel",
        "waits_for": []
      }
    ]
  },
  "conflicts_detected": []
}
